{
  "format": "CAMPFIRE_MAPWEAVER",
  "version": 3,
  "mapId": "cef9c012-4ab0-4796-8184-2e8f6c0e01ae",
  "revision": 10,
  "name": "Ceiling QA",
  "ceilingRegions": [
    {
      "id": "ceiling-ruin-1",
      "points": [
        {
          "x": 80,
          "y": 80
        },
        {
          "x": 350,
          "y": 80
        },
        {
          "x": 350,
          "y": 260
        },
        {
          "x": 80,
          "y": 260
        }
      ]
    },
    {
      "id": "ceiling-ruin-2",
      "points": [
        {
          "x": 410,
          "y": 80
        },
        {
          "x": 720,
          "y": 80
        },
        {
          "x": 720,
          "y": 220
        },
        {
          "x": 410,
          "y": 220
        }
      ]
    },
    {
      "id": "ceiling-ruin-3",
      "points": [
        {
          "x": 80,
          "y": 320
        },
        {
          "x": 260,
          "y": 320
        },
        {
          "x": 260,
          "y": 520
        },
        {
          "x": 80,
          "y": 520
        }
      ]
    },
    {
      "id": "ceiling-ruin-4",
      "points": [
        {
          "x": 480,
          "y": 400
        },
        {
          "x": 720,
          "y": 400
        },
        {
          "x": 720,
          "y": 520
        },
        {
          "x": 480,
          "y": 520
        }
      ]
    }
  ],
  "dimensions": {
    "pixelWidth": 800,
    "pixelHeight": 600
  },
  "grid": {
    "type": "SQUARE",
    "sizePx": 50,
    "feetPerCell": 5
  },
  "image": {
    "path": "map.png",
    "mimeType": "image/png"
  },
  "walls": [
    {
      "id": "1198b28b-265b-447c-b32a-4271dd515b74",
      "start": {
        "x": 70,
        "y": 70
      },
      "end": {
        "x": 269.00000000000006,
        "y": 70
      },
      "blocksVision": true
    },
    {
      "id": "1198b28b-265b-447c-b32a-4271dd515b74:a:window-ruin:1",
      "start": {
        "x": 319.00000000000006,
        "y": 70.00000000000001
      },
      "end": {
        "x": 730,
        "y": 70
      },
      "blocksVision": true
    },
    {
      "id": "1198b28b-265b-447c-b32a-4271dd515b74:b:start:1",
      "start": {
        "x": 730,
        "y": 70
      },
      "end": {
        "x": 730,
        "y": 530
      },
      "blocksVision": true
    },
    {
      "id": "1198b28b-265b-447c-b32a-4271dd515b74:c:start:1",
      "start": {
        "x": 730,
        "y": 530
      },
      "end": {
        "x": 70,
        "y": 530
      },
      "blocksVision": true
    },
    {
      "id": "1198b28b-265b-447c-b32a-4271dd515b74:d:start:1",
      "start": {
        "x": 70,
        "y": 530
      },
      "end": {
        "x": 70,
        "y": 70
      },
      "blocksVision": true
    },
    {
      "id": "1198b28b-265b-447c-b32a-4271dd515b74:window:window-ruin",
      "start": {
        "x": 269.00000000000006,
        "y": 70
      },
      "end": {
        "x": 319.00000000000006,
        "y": 70.00000000000001
      },
      "blocksVision": true
    }
  ],
  "doors": [],
  "windows": [
    {
      "id": "window-ruin",
      "wallId": "1198b28b-265b-447c-b32a-4271dd515b74:window:window-ruin",
      "geometry": {
        "start": {
          "x": 269.00000000000006,
          "y": 70
        },
        "end": {
          "x": 319.00000000000006,
          "y": 70.00000000000001
        }
      },
      "transmitsExteriorLight": true,
      "exteriorLightTransmission": 0.8
    }
  ],
  "lighting": {
    "ambient": {
      "intensity": 1
    },
    "lights": []
  }
}