{
  "format": "CAMPFIRE_MAPWEAVER",
  "version": 3,
  "mapId": "cef9c012-4ab0-4796-8184-2e8f6c0e01ae",
  "revision": 10,
  "name": "Ceiling QA",
  "ceilingRegions": [
    {
      "id": "ceiling-courtyard-1",
      "points": [
        {
          "x": 80,
          "y": 80
        },
        {
          "x": 720,
          "y": 80
        },
        {
          "x": 720,
          "y": 200
        },
        {
          "x": 80,
          "y": 200
        }
      ]
    },
    {
      "id": "ceiling-courtyard-2",
      "points": [
        {
          "x": 80,
          "y": 400
        },
        {
          "x": 720,
          "y": 400
        },
        {
          "x": 720,
          "y": 520
        },
        {
          "x": 80,
          "y": 520
        }
      ]
    },
    {
      "id": "ceiling-courtyard-3",
      "points": [
        {
          "x": 80,
          "y": 200
        },
        {
          "x": 240,
          "y": 200
        },
        {
          "x": 240,
          "y": 400
        },
        {
          "x": 80,
          "y": 400
        }
      ]
    },
    {
      "id": "ceiling-courtyard-4",
      "points": [
        {
          "x": 560,
          "y": 200
        },
        {
          "x": 720,
          "y": 200
        },
        {
          "x": 720,
          "y": 400
        },
        {
          "x": 560,
          "y": 400
        }
      ]
    }
  ],
  "dimensions": {
    "pixelWidth": 800,
    "pixelHeight": 600
  },
  "grid": {
    "type": "SQUARE",
    "sizePx": 50,
    "feetPerCell": 5
  },
  "image": {
    "path": "map.png",
    "mimeType": "image/png"
  },
  "walls": [
    {
      "id": "27eb4206-6454-4ddf-a5af-8655427d42c4",
      "start": {
        "x": 70,
        "y": 70
      },
      "end": {
        "x": 269.00000000000006,
        "y": 70
      },
      "blocksVision": true
    },
    {
      "id": "27eb4206-6454-4ddf-a5af-8655427d42c4:a:window-courtyard:1",
      "start": {
        "x": 319.00000000000006,
        "y": 70.00000000000001
      },
      "end": {
        "x": 730,
        "y": 70
      },
      "blocksVision": true
    },
    {
      "id": "27eb4206-6454-4ddf-a5af-8655427d42c4:b:start:1",
      "start": {
        "x": 730,
        "y": 70
      },
      "end": {
        "x": 730,
        "y": 530
      },
      "blocksVision": true
    },
    {
      "id": "27eb4206-6454-4ddf-a5af-8655427d42c4:c:start:1",
      "start": {
        "x": 730,
        "y": 530
      },
      "end": {
        "x": 70,
        "y": 530
      },
      "blocksVision": true
    },
    {
      "id": "27eb4206-6454-4ddf-a5af-8655427d42c4:d:start:1",
      "start": {
        "x": 70,
        "y": 530
      },
      "end": {
        "x": 70,
        "y": 70
      },
      "blocksVision": true
    },
    {
      "id": "27eb4206-6454-4ddf-a5af-8655427d42c4:window:window-courtyard",
      "start": {
        "x": 269.00000000000006,
        "y": 70
      },
      "end": {
        "x": 319.00000000000006,
        "y": 70.00000000000001
      },
      "blocksVision": true
    }
  ],
  "doors": [],
  "windows": [
    {
      "id": "window-courtyard",
      "wallId": "27eb4206-6454-4ddf-a5af-8655427d42c4:window:window-courtyard",
      "geometry": {
        "start": {
          "x": 269.00000000000006,
          "y": 70
        },
        "end": {
          "x": 319.00000000000006,
          "y": 70.00000000000001
        }
      },
      "transmitsExteriorLight": true,
      "exteriorLightTransmission": 0.8
    }
  ],
  "lighting": {
    "ambient": {
      "intensity": 1
    },
    "lights": []
  }
}