{
  "format": "CAMPFIRE_MAPWEAVER",
  "version": 3,
  "mapId": "cef9c012-4ab0-4796-8184-2e8f6c0e01ae",
  "revision": 10,
  "name": "Ceiling QA",
  "ceilingRegions": [
    {
      "id": "ceiling-cave-1",
      "points": [
        {
          "x": 80,
          "y": 80
        },
        {
          "x": 720,
          "y": 80
        },
        {
          "x": 720,
          "y": 520
        },
        {
          "x": 520,
          "y": 520
        },
        {
          "x": 520,
          "y": 330
        },
        {
          "x": 280,
          "y": 330
        },
        {
          "x": 280,
          "y": 520
        },
        {
          "x": 80,
          "y": 520
        }
      ]
    }
  ],
  "dimensions": {
    "pixelWidth": 800,
    "pixelHeight": 600
  },
  "grid": {
    "type": "SQUARE",
    "sizePx": 50,
    "feetPerCell": 5
  },
  "image": {
    "path": "map.png",
    "mimeType": "image/png"
  },
  "walls": [
    {
      "id": "ca602b63-4086-4a27-937c-c863e8b9ce26",
      "start": {
        "x": 70,
        "y": 70
      },
      "end": {
        "x": 269.00000000000006,
        "y": 70
      },
      "blocksVision": true
    },
    {
      "id": "ca602b63-4086-4a27-937c-c863e8b9ce26:a:window-cave:1",
      "start": {
        "x": 319.00000000000006,
        "y": 70.00000000000001
      },
      "end": {
        "x": 730,
        "y": 70
      },
      "blocksVision": true
    },
    {
      "id": "ca602b63-4086-4a27-937c-c863e8b9ce26:b:start:1",
      "start": {
        "x": 730,
        "y": 70
      },
      "end": {
        "x": 730,
        "y": 530
      },
      "blocksVision": true
    },
    {
      "id": "ca602b63-4086-4a27-937c-c863e8b9ce26:c:start:1",
      "start": {
        "x": 730,
        "y": 530
      },
      "end": {
        "x": 70,
        "y": 530
      },
      "blocksVision": true
    },
    {
      "id": "ca602b63-4086-4a27-937c-c863e8b9ce26:d:start:1",
      "start": {
        "x": 70,
        "y": 530
      },
      "end": {
        "x": 70,
        "y": 70
      },
      "blocksVision": true
    },
    {
      "id": "ca602b63-4086-4a27-937c-c863e8b9ce26:window:window-cave",
      "start": {
        "x": 269.00000000000006,
        "y": 70
      },
      "end": {
        "x": 319.00000000000006,
        "y": 70.00000000000001
      },
      "blocksVision": true
    }
  ],
  "doors": [],
  "windows": [
    {
      "id": "window-cave",
      "wallId": "ca602b63-4086-4a27-937c-c863e8b9ce26:window:window-cave",
      "geometry": {
        "start": {
          "x": 269.00000000000006,
          "y": 70
        },
        "end": {
          "x": 319.00000000000006,
          "y": 70.00000000000001
        }
      },
      "transmitsExteriorLight": true,
      "exteriorLightTransmission": 0.8
    }
  ],
  "lighting": {
    "ambient": {
      "intensity": 1
    },
    "lights": []
  }
}